{
  "api_version": "experiments.fips.network/analysis/v1alpha1",
  "artifact_id": "artifact-d2a75bd7afb985f4cedc43dc5f319f08",
  "run_id": "run-d2a75bd7afb985f4cedc43dc",
  "represented_nodes": 12,
  "representation": "exact-graph",
  "representation_boundaries": {
    "aggregate_max_nodes": 1000000,
    "exact_graph_max_nodes": 200
  },
  "fidelity": {
    "exact": true,
    "statement": "Wire evidence uses executable production codec; protocol fidelity is individually modeled semantic state; compute fidelity is operation-counted compute; scale uses individual nodes across 12 represented nodes; Bloom fidelity uses exact Bloom bits. No approximation metadata applies.",
    "uncertainty": []
  },
  "provenance": {
    "engine_name": "fips-individual-reference",
    "engine_version": "m2-v1",
    "engine_source_revision": "fecd252d1e0dda6cc2ea4be05fe191bc7ef9cb29",
    "schema_versions": {
      "normalized-plan": "experiments.fips.network/normalized-plan/v1alpha1",
      "reproduction-bundle": "experiments.fips.network/reproduction-bundle/v1alpha1",
      "run-artifact": "experiments.fips.network/run-artifact/v1alpha1"
    },
    "seed": 424242,
    "normalized_plan_sha256": "c855a48b0380ce1ddff72ded27afc421da8f88f048b9a5eb4bc05952b141a46f",
    "fips_commit": "80c956a6fdb85dde1450969a21891c1158e43267",
    "image_digest": null,
    "hardware_profile": null
  },
  "assertions": {
    "bloom-replacement-reconciliation": "pass",
    "byte-reconciliation": "pass",
    "cache-invalidation-scope": "pass",
    "causal-ledger-frame-reconciliation": "pass",
    "continuous-control-eventual-data-progress": "pass",
    "control-queues-return-to-baseline": "pass",
    "coordinate-consistency": "pass",
    "deterministic-total-order": "pass",
    "loop-freedom": "pass",
    "modeled-work-has-resource-receipts": "pass",
    "no-obsolete-root-retention": "pass",
    "per-peer-debounce": "pass",
    "root-agreement": "pass",
    "tree-lifecycle-reconciliation": "pass"
  },
  "metrics": [
    {
      "name": "root.generations",
      "unit": "count",
      "first": "11",
      "last": "11",
      "minimum": "11",
      "maximum": "11",
      "source": {
        "collection": "metric_series/root.generations",
        "start": 0,
        "end_exclusive": 1,
        "total": 1
      }
    },
    {
      "name": "tree.maximum-depth",
      "unit": "edges",
      "first": "8",
      "last": "8",
      "minimum": "8",
      "maximum": "8",
      "source": {
        "collection": "metric_series/tree.maximum-depth",
        "start": 0,
        "end_exclusive": 1,
        "total": 1
      }
    },
    {
      "name": "tree.parent-transitions",
      "unit": "count",
      "first": "14",
      "last": "14",
      "minimum": "14",
      "maximum": "14",
      "source": {
        "collection": "metric_series/tree.parent-transitions",
        "start": 0,
        "end_exclusive": 1,
        "total": 1
      }
    },
    {
      "name": "adversary.authenticated-sybil-arrivals",
      "unit": "count",
      "first": "0",
      "last": "0",
      "minimum": "0",
      "maximum": "0",
      "source": {
        "collection": "metric_series/adversary.authenticated-sybil-arrivals",
        "start": 0,
        "end_exclusive": 1,
        "total": 1
      }
    },
    {
      "name": "tree-announce.transmitted-bytes",
      "unit": "bytes",
      "first": "36504",
      "last": "36504",
      "minimum": "36504",
      "maximum": "36504",
      "source": {
        "collection": "metric_series/tree-announce.transmitted-bytes",
        "start": 0,
        "end_exclusive": 1,
        "total": 1
      }
    },
    {
      "name": "quiescence",
      "unit": "nanoseconds",
      "first": "5501361600",
      "last": "5501361600",
      "minimum": "5501361600",
      "maximum": "5501361600",
      "source": {
        "collection": "metric_series/quiescence",
        "start": 0,
        "end_exclusive": 1,
        "total": 1
      }
    },
    {
      "name": "quiescence.root",
      "unit": "nanoseconds",
      "first": "5501361600",
      "last": "5501361600",
      "minimum": "5501361600",
      "maximum": "5501361600",
      "source": {
        "collection": "metric_series/quiescence.root",
        "start": 0,
        "end_exclusive": 1,
        "total": 1
      }
    },
    {
      "name": "quiescence.tree",
      "unit": "nanoseconds",
      "first": "5501361600",
      "last": "5501361600",
      "minimum": "5501361600",
      "maximum": "5501361600",
      "source": {
        "collection": "metric_series/quiescence.tree",
        "start": 0,
        "end_exclusive": 1,
        "total": 1
      }
    },
    {
      "name": "quiescence.bloom",
      "unit": "nanoseconds",
      "first": "5504361600",
      "last": "5504361600",
      "minimum": "5504361600",
      "maximum": "5504361600",
      "source": {
        "collection": "metric_series/quiescence.bloom",
        "start": 0,
        "end_exclusive": 1,
        "total": 1
      }
    },
    {
      "name": "quiescence.lookup",
      "unit": "nanoseconds",
      "first": "6301341600",
      "last": "6301341600",
      "minimum": "6301341600",
      "maximum": "6301341600",
      "source": {
        "collection": "metric_series/quiescence.lookup",
        "start": 0,
        "end_exclusive": 1,
        "total": 1
      }
    },
    {
      "name": "quiescence.data-plane",
      "unit": "nanoseconds",
      "first": "6601516800",
      "last": "6601516800",
      "minimum": "6601516800",
      "maximum": "6601516800",
      "source": {
        "collection": "metric_series/quiescence.data-plane",
        "start": 0,
        "end_exclusive": 1,
        "total": 1
      }
    },
    {
      "name": "traffic.useful-delivered",
      "unit": "bytes",
      "first": "24576",
      "last": "24576",
      "minimum": "24576",
      "maximum": "24576",
      "source": {
        "collection": "metric_series/traffic.useful-delivered",
        "start": 0,
        "end_exclusive": 1,
        "total": 1
      }
    },
    {
      "name": "cache.invalidations",
      "unit": "count",
      "first": "20",
      "last": "20",
      "minimum": "20",
      "maximum": "20",
      "source": {
        "collection": "metric_series/cache.invalidations",
        "start": 0,
        "end_exclusive": 1,
        "total": 1
      }
    },
    {
      "name": "bloom.fpr",
      "unit": "parts-per-billion",
      "first": "0",
      "last": "0",
      "minimum": "0",
      "maximum": "0",
      "source": {
        "collection": "metric_series/bloom.fpr",
        "start": 0,
        "end_exclusive": 1,
        "total": 1
      }
    },
    {
      "name": "resource.maximum-queue-wait",
      "unit": "nanoseconds",
      "first": "20000",
      "last": "20000",
      "minimum": "20000",
      "maximum": "20000",
      "source": {
        "collection": "metric_series/resource.maximum-queue-wait",
        "start": 0,
        "end_exclusive": 1,
        "total": 1
      }
    }
  ],
  "quiescence": {
    "root_ns": 5501361600,
    "tree_ns": 5501361600,
    "bloom_ns": 5504361600,
    "lookup_ns": 6301341600,
    "data_plane_ns": 6601516800
  },
  "causal": {
    "stages": [
      {
        "stage": "coalesced",
        "count": 2,
        "entries": 2
      },
      {
        "stage": "compute",
        "count": 417,
        "entries": 123
      },
      {
        "stage": "constructed",
        "count": 139,
        "entries": 5
      },
      {
        "stage": "delivered",
        "count": 181004,
        "entries": 195
      },
      {
        "stage": "fmp",
        "count": 135288,
        "entries": 190
      },
      {
        "stage": "fsp",
        "count": 9432,
        "entries": 54
      },
      {
        "stage": "identity-generation-operations",
        "count": 4,
        "entries": 4
      },
      {
        "stage": "lower-bound",
        "count": 140608,
        "entries": 190
      },
      {
        "stage": "network",
        "count": 140608,
        "entries": 190
      },
      {
        "stage": "payload",
        "count": 24576,
        "entries": 48
      },
      {
        "stage": "performed",
        "count": 81,
        "entries": 81
      },
      {
        "stage": "queued",
        "count": 177112,
        "entries": 195
      },
      {
        "stage": "requested",
        "count": 169,
        "entries": 29
      },
      {
        "stage": "serialized",
        "count": 171792,
        "entries": 195
      },
      {
        "stage": "signed",
        "count": 139,
        "entries": 5
      },
      {
        "stage": "state",
        "count": 2128,
        "entries": 1
      },
      {
        "stage": "state-mutated",
        "count": 24691,
        "entries": 88
      },
      {
        "stage": "superseded",
        "count": 2,
        "entries": 2
      },
      {
        "stage": "time",
        "count": 6601516800,
        "entries": 1
      },
      {
        "stage": "transmitted",
        "count": 181004,
        "entries": 195
      },
      {
        "stage": "transport",
        "count": 5320,
        "entries": 190
      },
      {
        "stage": "useful-payload",
        "count": 24576,
        "entries": 48
      }
    ],
    "roots": [
      "flow-00000000",
      "flow-00000001",
      "flow-00000002",
      "flow-00000003",
      "flow-00000004",
      "flow-00000005",
      "flow-00000006",
      "flow-00000007",
      "flow-00000008",
      "flow-00000009",
      "flow-00000010",
      "flow-00000011",
      "flow-00000012",
      "flow-00000013",
      "flow-00000014",
      "flow-00000015",
      "flow-00000016",
      "flow-00000017",
      "flow-00000018",
      "flow-00000019",
      "flow-00000020",
      "flow-00000021",
      "flow-00000022",
      "flow-00000023",
      "flow-00000024",
      "flow-00000025",
      "flow-00000026",
      "flow-00000027",
      "flow-00000028",
      "flow-00000029",
      "flow-00000030",
      "flow-00000031",